municipio,codigo,receita_corrente,divida_consolidada,pessoal_encargos,cap_pag_div,eq1_cap_pag_div
Prefeitura Municipal de Floraí - PR,4107801,22069638.18,0,9012936.85,0,2.8928819
Prefeitura Municipal de Flor da Serra do Sul - PR,4107850,24955806.51,0,9612169.93,0,2.8928819
Prefeitura Municipal de Floresta - PR,4107900,29523760.53,750367,15289637.62,.052716069,2.8946092
Prefeitura Municipal de Florestópolis - PR,4108007,33800788.44,0,15753410.89,0,2.8928819
Prefeitura Municipal de Flórida - PR,4108106,17807364.52,1615915,8974448.6,.18294242,2.8988764
Prefeitura Municipal de Formosa do Oeste - PR,4108205,29638670.74,0,11624368.46,0,2.8928819
Prefeitura Municipal de Foz do Iguaçu - PR,4108304,1093291806.22,202533124,541572361.15,.3670944,2.9049103
Prefeitura Municipal de Francisco Alves - PR,4108320,27941173.68,0,10097566.06,0,2.8928819
Prefeitura Municipal de Francisco Beltrão - PR,4108403,303070760.43,32091616,142130668.71,.19940101,2.8994157
Prefeitura Municipal de Foz do Jordão - PR,4108452,22183912.53,0,10045529.38,0,2.8928819
Prefeitura Municipal de General Carneiro - PR,4108502,37537636.37,7005643,17730346.57,.35369015,2.9044712
Prefeitura Municipal de Godoy Moreira - PR,4108551,2169630.98,0,7818334.65,0,2.8928819
Prefeitura Municipal de Goioerê - PR,4108601,85580634.93000001,0,38264417.57,0,2.8928819
Prefeitura Municipal de Goioxim - PR,4108650,28289625.28,0,8681070.310000001,0,2.8928819
Prefeitura Municipal de Grandes Rios - PR,4108700,18736489.47,6131698,10055149.74,.70630783,2.9160252
Prefeitura Municipal de Guaíra - PR,4108809,114122409.16,4292854,51171555.72,.068193741,2.8951163
Prefeitura Municipal de Guairaçá - PR,4108908,24967216.84,5502975,11942477.44,.42250174,2.9067259
Prefeitura Municipal de Guamiranga - PR,4108957,23404055.2,0,11471606.82,0,2.8928819
Prefeitura Municipal de Guapirama - PR,4109005,20659448.24,0,8729491.23,0,2.8928819
Prefeitura Municipal de Guaporema - PR,4109104,16306791.42,0,6850190.34,0,2.8928819
Prefeitura Municipal de Guaraci - PR,4109203,26572879.91,0,12975604.98,0,2.8928819
Prefeitura Municipal de Guaraniaçu - PR,4109302,53799677.1,0,27641254.13,0,2.8928819
Prefeitura Municipal de Guarapuava - PR,4109401,498874941.44,34801790,246079642.8,.13766786,2.8973927
Prefeitura Municipal de Guaraqueçaba - PR,4109500,27163198.64,3792585,12539778.02,.25935006,2.9013801
Prefeitura Municipal de Guaratuba - PR,4109609,155797969.92,0,82549353.48999999,0,2.8928819
Prefeitura Municipal de Honório Serpa - PR,4109658,27492028.99,0,11833259.91,0,2.8928819
Prefeitura Municipal de Ibaiti - PR,4109708,58470329.51,5373193,28580781.67,.17976829,2.8987722
Prefeitura Municipal de Ibema - PR,4109757,21780952.79,0,10476002.8,0,2.8928819
Prefeitura Municipal de Ibiporã - PR,4109807,207835239.42,5634082,108056614.69,.056465823,2.8947322
Prefeitura Municipal de Icaraíma - PR,4109906,34117246.31,5288899,15598256.97,.28559327,2.9022398
Prefeitura Municipal de Iguaraçu - PR,4110003,25161686.42,6344821,12709209.44,.5095228,2.9095774
Prefeitura Municipal de Iguatu - PR,4110052,13059586.58,0,5911134.48,0,2.8928819
Prefeitura Municipal de Imbaú - PR,4110078,31560693.47,444950,15586668,.027854593,2.8937945
Prefeitura Municipal de Imbituva - PR,4110102,85899099.09999999,0,41561279.01,0,2.8928819
Prefeitura Municipal de Inácio Martins - PR,4110201,38662518.24,0,17668074.44,0,2.8928819
Prefeitura Municipal de Inajá - PR,4110300,17275994.84,0,8685536.1,0,2.8928819
Prefeitura Municipal de Indianópolis - PR,4110409,26442593.11,0,12448317.03,0,2.8928819
Prefeitura Municipal de Ipiranga - PR,4110508,49017621.53,0,20740183.81,0,2.8928819
Prefeitura Municipal de Iporã - PR,4110607,49408238.15,0,16254852.44,0,2.8928819
Prefeitura Municipal de Iracema do Oeste - PR,4110656,18243363.07,658150,7534074.02,.061455995,2.8948956
Prefeitura Municipal de Irati - PR,4110706,156420245.55,4386400,77591949.23,.055644993,2.8947053
Prefeitura Municipal de Iretama - PR,4110805,42766920.02,0,18836278.58,0,2.8928819
Prefeitura Municipal de Itaguajé - PR,4110904,22204981.22,0,11103340.11,0,2.8928819
Prefeitura Municipal de Itaipulândia - PR,4110953,112769613.58,0,27854890.12,0,2.8928819
Prefeitura Municipal de Itambaracá - PR,4111001,23757231.14,0,10340169.01,0,2.8928819
Prefeitura Municipal de Itambé - PR,4111100,23516564.87,0,10509919.34,0,2.8928819
Prefeitura Municipal de Itapejara d'Oeste - PR,4111209,42659836.81,0,17004332.68,0,2.8928819
Prefeitura Municipal de Itaperuçu - PR,4111258,57220093.49,0,26276273.7,0,2.8928819
Prefeitura Municipal de Itaúna do Sul - PR,4111308,16878312.85,1862607,7120890.04,.19089128,2.8991368
Prefeitura Municipal de Ivaí - PR,4111407,37917444.15,0,14494416.13,0,2.8928819
Prefeitura Municipal de Ivaiporã - PR,4111506,90198262.44,0,40763005.95,0,2.8928819
Prefeitura Municipal de Ivaté - PR,4111555,24943083.29,0,12983901.57,0,2.8928819
Prefeitura Municipal de Ivatuba - PR,4111605,64398963.33,639997,9441109.439999999,.011645232,2.8932636
Prefeitura Municipal de Jaboti - PR,4111704,22093692.24,1932306,10951412.77,.17342107,2.8985643
Prefeitura Municipal de Jacarezinho - PR,4111803,109494514.01,9728904,55935455.91,.18164815,2.898834
Prefeitura Municipal de Jaguapitã - PR,4111902,49059429.66,4314784,22619171.02,.16318993,2.8982291
Prefeitura Municipal de Jaguariaíva - PR,4112009,107885612.54,0,53176363.34,0,2.8928819
Prefeitura Municipal de Jandaia do Sul - PR,4112108,61477426.84,1043754,25689903.96,.029165305,2.8938377
Prefeitura Municipal de Janiópolis - PR,4112207,25460397.31,1209613,14567894.52,.11105005,2.8965206
Prefeitura Municipal de Japira - PR,4112306,21063483.11,0,9043827.210000001,0,2.8928819
Prefeitura Municipal de Japurá - PR,4112405,34028162.18,0,18296894.6,0,2.8928819
Prefeitura Municipal de Jardim Alegre - PR,4112504,38253374.86,2542779,14760803.51,.10823758,2.8964286
Prefeitura Municipal de Jardim Olinda - PR,4112603,17241392.78,0,7497993.13,0,2.8928819
Prefeitura Municipal de Jataizinho - PR,4112702,32635635.64,2477764,18313938.93,.17300771,2.8985507
Prefeitura Municipal de Jesuítas - PR,4112751,31380848.97,2681343,14750129.39,.16122831,2.8981647
Prefeitura Municipal de Joaquim Távora - PR,4112801,41098397.25,0,18685676.81,0,2.8928819
Prefeitura Municipal de Jundiaí do Sul - PR,4112900,24205092.47,0,7786937.91,0,2.8928819
Prefeitura Municipal de Juranda - PR,4112959,30178688.53,0,11017499.72,0,2.8928819
Prefeitura Municipal de Jussara - PR,4113007,27896962.1,0,11372291.52,0,2.8928819
Prefeitura Municipal de Kaloré - PR,4113106,20084971.91,0,8799135.99,0,2.8928819
Prefeitura Municipal de Lapa - PR,4113205,153064223.58,0,82100514.38,0,2.8928819
Prefeitura Municipal de Laranjal - PR,4113254,22820820.52,0,9882970.57,0,2.8928819
Prefeitura Municipal de Laranjeiras do Sul - PR,4113304,88260337.3,0,47082491.42,0,2.8928819
Prefeitura Municipal de Leópolis - PR,4113403,21133366.67,0,10192300.61,0,2.8928819
Prefeitura Municipal de Lidianópolis - PR,4113429,17471400.08,0,8001069.64,0,2.8928819
Prefeitura Municipal de Lindoeste - PR,4113452,23558137.23,0,11399475.02,0,2.8928819
Prefeitura Municipal de Loanda - PR,4113502,67001145,0,36359452.92,0,2.8928819
Prefeitura Municipal de Lobato - PR,4113601,24318540.39,0,14372245.78,0,2.8928819
Prefeitura Municipal de Londrina - PR,4113700,1748490045.35,575852571,1148041932.72,.95903802,2.9243064
Prefeitura Municipal de Luiziana - PR,4113734,30157101.12,1076521,18213326,.090132393,2.8958352
Prefeitura Municipal de Lunardelli - PR,4113759,459107.53,4044844,8383747.09,-.51041365,2.8761573
Prefeitura Municipal de Lupionópolis - PR,4113809,21125031.92,818375,9889055.92,.072835237,2.8952684
Prefeitura Municipal de Mallet - PR,4113908,38406807.83,0,19762527.32,0,2.8928819
Prefeitura Municipal de Mamborê - PR,4114005,54343067.75,0,25618685.62,0,2.8928819
Prefeitura Municipal de Mandaguaçu - PR,4114104,63820591.98,0,36672033.61,0,2.8928819
Prefeitura Municipal de Mandaguari - PR,4114203,104365979.88,0,47723011.05,0,2.8928819
Prefeitura Municipal de Mandirituba - PR,4114302,70285801.22,9993339,38824295.31,.31763703,2.9032898
Prefeitura Municipal de Manfrinópolis - PR,4114351,16741178.14,0,6961730.48,0,2.8928819
Prefeitura Municipal de Mangueirinha - PR,4114401,114646919.25,6817007,32911499.23,.083403341,2.8956149
Prefeitura Municipal de Manoel Ribas - PR,4114500,42021459.25,0,19591070.09,0,2.8928819
Prefeitura Municipal de Marechal Cândido Rondon - PR,4114609,204909406.39,19123869,95250413.51000001,.17439398,2.8985963
Prefeitura Municipal de Maria Helena - PR,4114708,2209184.96,0,11508568.83,0,2.8928819
Prefeitura Municipal de Marialva - PR,4114807,91849993.54000001,0,52769051.84,0,2.8928819
Prefeitura Municipal de Marilândia do Sul - PR,4114906,29803891.56,0,14091200.12,0,2.8928819
Prefeitura Municipal de Marilena - PR,4115002,24340549.82,0,12476040.57,0,2.8928819
Prefeitura Municipal de Mariluz - PR,4115101,29545629.79,0,18370482.57,0,2.8928819
Prefeitura Municipal de Maringá - PR,4115200,1471207939.43,405391781,706072617.8,.52983016,2.9102428
Prefeitura Municipal de Mariópolis - PR,4115309,30575961.87,0,14231951.06,0,2.8928819
Prefeitura Municipal de Maripá - PR,4115358,37156236.32,0,15799041.5,0,2.8928819
Prefeitura Municipal de Marmeleiro - PR,4115408,55587875.95,0,22257592.99,0,2.8928819
Prefeitura Municipal de Marquinho - PR,4115457,24050823.38,0,9982850.51,0,2.8928819
Prefeitura Municipal de Marumbi - PR,4115507,19677993.29,2769459,8982014.939999999,.25892526,2.901366
Prefeitura Municipal de Matelândia - PR,4115606,79529626.04000001,0,37611820.76,0,2.8928819
Prefeitura Municipal de Matinhos - PR,4115705,141123847.19,0,56513692.25,0,2.8928819
Prefeitura Municipal de Mato Rico - PR,4115739,21655709.92,732719,10118092.64,.063506961,2.8949628
Prefeitura Municipal de Mauá da Serra - PR,4115754,109070698.23,0,14842820.41,0,2.8928819
Prefeitura Municipal de Medianeira - PR,4115804,155522167.58,20094942,80255665.68000001,.26698387,2.9016302
Prefeitura Municipal de Mercedes - PR,4115853,35722821.79,0,15433790.66,0,2.8928819
Prefeitura Municipal de Mirador - PR,4115903,16329225.06,11501767,6771995.51,1.2034625,2.9323153
Prefeitura Municipal de Miraselva - PR,4116000,15671735.45,1760703,7167575.86,.20704021,2.8996658
Prefeitura Municipal de Missal - PR,4116059,57458811.45,0,26905506.22,0,2.8928819
Prefeitura Municipal de Moreira Sales - PR,4116109,37985842.52,0,16614605.35,0,2.8928819
Prefeitura Municipal de Morretes - PR,4116208,52578653.87,4817811,27979303.92,.19585115,2.8992994
Prefeitura Municipal de Munhoz de Melo - PR,4116307,24122002.12,0,10006702.98,0,2.8928819
Prefeitura Municipal de Nossa Senhora das Graças - PR,4116406,14463359.91,0,7799116.8,0,2.8928819
Prefeitura Municipal de Nova Aliança do Ivaí - PR,4116505,14597557.61,0,6600386.44,0,2.8928819
Prefeitura Municipal de Nova América da Colina - PR,4116604,22325612.07,0,8082878.93,0,2.8928819
Prefeitura Municipal de Nova Aurora - PR,4116703,49407982.09,0,21273887.02,0,2.8928819
Prefeitura Municipal de Nova Cantu - PR,4116802,27826415.11,0,11205652.48,0,2.8928819
Prefeitura Municipal de Nova Esperança - PR,4116901,78585198,0,42377574.75,0,2.8928819
Prefeitura Municipal de Nova Esperança do Sudoeste - PR,4116950,22841978.33,0,9842462.609999999,0,2.8928819
Prefeitura Municipal de Nova Fátima - PR,4117008,25851621.06,0,12830601.69,0,2.8928819
Prefeitura Municipal de Nova Laranjeiras - PR,4117057,37213575.91,0,14088877.9,0,2.8928819
Prefeitura Municipal de Nova Londrina - PR,4117107,41518555.23,0,21315035.21,0,2.8928819
Prefeitura Municipal de Nova Olímpia - PR,4117206,23902538.94,0,11471099.86,0,2.8928819
Prefeitura Municipal de Nova Santa Bárbara - PR,4117214,17627534.32,718777,8443599.859999999,.078264602,2.8954463
Prefeitura Municipal de Nova Santa Rosa - PR,4117222,38026417.45,0,15920428.06,0,2.8928819
Prefeitura Municipal de Nova Prata do Iguaçu - PR,4117255,45719457.98,0,21228073.11,0,2.8928819
Prefeitura Municipal de Nova Tebas - PR,4117271,28439834.13,0,13819613.86,0,2.8928819
Prefeitura Municipal de Novo Itacolomi - PR,4117297,16869897.48,1190726,8539857.42,.14294361,2.8975656
Prefeitura Municipal de Ortigueira - PR,4117305,87405716.67,2555544,32990919.23,.046964139,2.8944209
Prefeitura Municipal de Ourizona - PR,4117404,18221255.82,425874,7057260.72,.038147096,2.8941319
Prefeitura Municipal de Ouro Verde do Oeste - PR,4117453,30460443.16,0,12308060.4,0,2.8928819
Prefeitura Municipal de Paiçandu - PR,4117503,84328402.75,4217971,45821562.89,.10953823,2.896471
Prefeitura Municipal de Palmas - PR,4117602,125994169.9,5583592,50915127.2,.074369512,2.8953187
Prefeitura Municipal de Palmeira - PR,4117701,117280338.01,0,60645985.59,0,2.8928819
Prefeitura Municipal de Palmital - PR,4117800,45162402.48,0,23632530.86,0,2.8928819
Prefeitura Municipal de Palotina - PR,4117909,143980259.45,0,66237093.42,0,2.8928819
Prefeitura Municipal de Paraíso do Norte - PR,4118006,37544583.69,0,17329764.51,0,2.8928819
Prefeitura Municipal de Paranacity - PR,4118105,34440958.5,0,17427554.12,0,2.8928819
Prefeitura Municipal de Paranaguá - PR,4118204,523428498.54,48276491,261025984.49,.18397877,2.8989103
Prefeitura Municipal de Paranapoema - PR,4118303,16406512.73,0,8077777.79,0,2.8928819
Prefeitura Municipal de Paranavaí - PR,4118402,251583106.77,71872290,121385858.78,.55202621,2.91097
Prefeitura Municipal de Pato Bragado - PR,4118451,44213219.98,0,15745933.82,0,2.8928819
Prefeitura Municipal de Pato Branco - PR,4118501,306964660.19,29732325,134071877.43,.17196973,2.8985169
Prefeitura Municipal de Paula Freitas - PR,4118600,22339712.69,0,9770952.189999999,0,2.8928819
Prefeitura Municipal de Paulo Frontin - PR,4118709,21335428.7,5846894,12282552.37,.64586037,2.9140446
Prefeitura Municipal de Peabiru - PR,4118808,48397890.78,0,24261187.88,0,2.8928819
Prefeitura Municipal de Perobal - PR,4118857,28074619.35,310276,11401859.69,.018609757,2.8934917
Prefeitura Municipal de Pérola - PR,4118907,42012702.61,3677303,23014272,.19355825,2.8992243
Prefeitura Municipal de Pérola d'Oeste - PR,4119004,20044677.74,0,9139004.470000001,0,2.8928819
Prefeitura Municipal de Piên - PR,4119103,45685150.03,0,23427934.62,0,2.8928819
Prefeitura Municipal de Pinhais - PR,4119152,419260200.72,5305457,193665417.43,.02351764,2.8936524
Prefeitura Municipal de Pinhalão - PR,4119202,22239245.98,2315547,10475639.53,.19683988,2.8993318
Prefeitura Municipal de Pinhal de São Bento - PR,4119251,15372268.81,0,4849340.76,0,2.8928819
Prefeitura Municipal de Pinhão - PR,4119301,104369777.37,2846315,53908497.56,.056405921,2.8947301
Prefeitura Municipal de Piraí do Sul - PR,4119400,80378865.19,10749371,41464745.16,.27623317,2.9019332
Prefeitura Municipal de Piraquara - PR,4119509,234196232.64,23562796,122262664.4,.21050696,2.8997796
Prefeitura Municipal de Pitanga - PR,4119608,95887176.89,0,48814121.06,0,2.8928819
Prefeitura Municipal de Pitangueiras - PR,4119657,17924534.85,0,8419936.710000001,0,2.8928819
Prefeitura Municipal de Planaltina do Paraná - PR,4119707,17060930.08,0,7497207.58,0,2.8928819
Prefeitura Municipal de Planalto - PR,4119806,48882677.37,0,18930691.57,0,2.8928819
Prefeitura Municipal de Ponta Grossa - PR,4119905,766407209.6,433464399,448811281.63,1.3648298,2.9376028
Prefeitura Municipal de Pontal do Paraná - PR,4119954,110501203.98,0,49554745.09,0,2.8928819
Prefeitura Municipal de Porecatu - PR,4120002,40694444.11,22583473,20494237.04,1.1179823,2.9295144
Prefeitura Municipal de Porto Amazonas - PR,4120101,20597938.1,0,8221800.84,0,2.8928819
Prefeitura Municipal de Porto Barreiro - PR,4120150,22530042.95,0,8996245.640000001,0,2.8928819
Prefeitura Municipal de Porto Rico - PR,4120200,20500770.79,867518,9763435.59,.080794536,2.8955293
Prefeitura Municipal de Porto Vitória - PR,4120309,19941449.56,0,8361010.88,0,2.8928819
Prefeitura Municipal de Prado Ferreira - PR,4120333,19450138,142090,8495538.310000001,.012970807,2.893307
Prefeitura Municipal de Pranchita - PR,4120358,27328231.16,746808,9460619.92,.041796744,2.8942516
Prefeitura Municipal de Presidente Castelo Branco - PR,4120408,18482268.33,0,8542208.140000001,0,2.8928819
Prefeitura Municipal de Primeiro de Maio - PR,4120507,38286311.76,1693299,19085475.26,.088188812,2.8957715
Prefeitura Municipal de Prudentópolis - PR,4120606,133820482.91,9341490,63193543.31,.13226525,2.8972158
Prefeitura Municipal de Quarto Centenário - PR,4120655,25977222.93,0,11740030.28,0,2.8928819
Prefeitura Municipal de Quatiguá - PR,4120705,26840351.9,0,13339178.19,0,2.8928819
Prefeitura Municipal de Quatro Barras - PR,4120804,104997950.11,0,52510133.36,0,2.8928819
Prefeitura Municipal de Quatro Pontes - PR,4120853,25689454.73,0,10177947.21,0,2.8928819
Prefeitura Municipal de Quedas do Iguaçu - PR,4120903,84125900.48,0,38326030.68,0,2.8928819
Prefeitura Municipal de Querência do Norte - PR,4121000,34830305.36,2717257,19411614.82,.17623137,2.8986564
Prefeitura Municipal de Quinta do Sol - PR,4121109,25389573.32,1863030,10352927.88,.12389931,2.8969417
Prefeitura Municipal de Quitandinha - PR,4121208,55448874.34,0,26256279.82,0,2.8928819
Prefeitura Municipal de Ramilândia - PR,4121257,19038524,0,8744474.6,0,2.8928819
Prefeitura Municipal de Rancho Alegre - PR,4121307,15579902.31,0,13172332.26,0,2.8928819
Prefeitura Municipal de Rancho Alegre D'Oeste - PR,4121356,20037101.43,0,7321025.1,0,2.8928819
Prefeitura Municipal de Realeza - PR,4121406,54996154.69,0,22110666.31,0,2.8928819
Prefeitura Municipal de Rebouças - PR,4121505,37710106.61,0,18661111.78,0,2.8928819
Prefeitura Municipal de Renascença - PR,4121604,31072966.99,0,14157504.13,0,2.8928819
Prefeitura Municipal de Reserva - PR,4121703,74233233.91,0,38613931.04,0,2.8928819
Prefeitura Municipal de Reserva do Iguaçu - PR,4121752,32987126.52,0,15172580.42,0,2.8928819
Prefeitura Municipal de Ribeirão Claro - PR,4121802,44513015.61,0,22466337.73,0,2.8928819
Prefeitura Municipal de Ribeirão do Pinhal - PR,4121901,31394929.57,959524,17638729.81,.069752112,2.8951676
Prefeitura Municipal de Rio Azul - PR,4122008,49269950.24,0,24159907.63,0,2.8928819
Prefeitura Municipal de Rio Bom - PR,4122107,16341343.78,2592547,7784091.17,.30296487,2.9028091
Prefeitura Municipal de Rio Bonito do Iguaçu - PR,4122156,46788072.87,0,21524862.62,0,2.8928819
Prefeitura Municipal de Rio Branco do Ivaí - PR,4122172,1760595.63,0,9557051.4,0,2.8928819
Prefeitura Municipal de Rio Branco do Sul - PR,4122206,112844514.83,0,47510387.32,0,2.8928819
Prefeitura Municipal de Rio Negro - PR,4122305,97941922.28,0,47603388.29,0,2.8928819
Prefeitura Municipal de Rolândia - PR,4122404,204072138.16,19597235,110727064.7,.20994397,2.8997612
Prefeitura Municipal de Roncador - PR,4122503,130812873.11,0,19400802.41,0,2.8928819
Prefeitura Municipal de Rondon - PR,4122602,27280192.83,1801214,13538785.78,.1310793,2.897177
Prefeitura Municipal de Rosário do Ivaí - PR,4122651,20554140.22,187745,9554230.6,.017067868,2.8934412
Prefeitura Municipal de Sabáudia - PR,4122701,32050469.15,0,15190362.1,0,2.8928819
Prefeitura Municipal de Salgado Filho - PR,4122800,21660297.62,0,8083335.4,0,2.8928819
Prefeitura Municipal de Salto do Itararé - PR,4122909,19402157.51,813522,8869078.07,.077234961,2.8954127
Prefeitura Municipal de Salto do Lontra - PR,4123006,45266652.95,4986797,19555515.31,.19395474,2.8992372
Prefeitura Municipal de Santa Amélia - PR,4123105,16679731.08,2062644,7037990.19,.21392858,2.8998916
Prefeitura Municipal de Santa Cecília do Pavão - PR,4123204,19318799.04,0,7817302.11,0,2.8928819
Prefeitura Municipal de Santa Cruz de Monte Castelo - PR,4123303,28180995.16,0,13425299.03,0,2.8928819
Prefeitura Municipal de Santa Fé - PR,4123402,40964745.05,0,18890720.76,0,2.8928819
Prefeitura Municipal de Santa Helena - PR,4123501,187792675.25,0,54732876.35,0,2.8928819
Prefeitura Municipal de Santa Inês - PR,4123600,12995047.98,3485141,6831314.97,.56542701,2.9114091
Prefeitura Municipal de Santa Isabel do Ivaí - PR,4123709,29393326.28,0,13250408.7,0,2.8928819
Prefeitura Municipal de Santa Izabel do Oeste - PR,4123808,47793423.52,0,19404164.28,0,2.8928819
Prefeitura Municipal de Santa Lúcia - PR,4123824,19332138.98,0,8825545.99,0,2.8928819
Prefeitura Municipal de Santa Maria do Oeste - PR,4123857,32868912.87,2641458,16402513.33,.16041504,2.8981383
Prefeitura Municipal de Santa Mariana - PR,4123907,35834931.08,0,15218015.99,0,2.8928819
Prefeitura Municipal de Santa Mônica - PR,4123956,21988978.43,0,9276988.42,0,2.8928819
Prefeitura Municipal de Santana do Itararé - PR,4124004,21290547.92,0,9081101.130000001,0,2.8928819
Prefeitura Municipal de Santa Tereza do Oeste - PR,4124020,42412543.84,0,19147260.06,0,2.8928819
Prefeitura Municipal de Santa Terezinha de Itaipu - PR,4124053,90700693.28,0,34944922.2,0,2.8928819
Prefeitura Municipal de Santo Antônio da Platina - PR,4124103,105890525.18,0,49646010.04,0,2.8928819
Prefeitura Municipal de Santo Antônio do Caiuá - PR,4124202,15983074.26,0,8009974.77,0,2.8928819
Prefeitura Municipal de Santo Antônio do Paraíso - PR,4124301,17224867.22,2168155,7780296.14,.22956628,2.900404
Prefeitura Municipal de Santo Antônio do Sudoeste - PR,4124400,55851031.15,6065377,26049774.34,.20352755,2.8995509
Prefeitura Municipal de Santo Inácio - PR,4124509,27683855.5,5349272,12696658.59,.35692278,2.904577
Prefeitura Municipal de São Carlos do Ivaí - PR,4124608,26883861.99,0,12136791.05,0,2.8928819
Prefeitura Municipal de São Jerônimo da Serra - PR,4124707,4142319.72,5225837,16125031.37,-.43611473,2.878592
Prefeitura Municipal de São João - PR,4124806,44791801.74,0,18785856.87,0,2.8928819
Prefeitura Municipal de São João do Caiuá - PR,4124905,19982525.37,0,9574657.08,0,2.8928819
Prefeitura Municipal de São João do Ivaí - PR,4125001,36483111.71,0,16931035.79,0,2.8928819
Prefeitura Municipal de São João do Triunfo - PR,4125100,40508748.21,0,18804741.02,0,2.8928819
Prefeitura Municipal de São Jorge d'Oeste - PR,4125209,49808218.9,0,20101264.58,0,2.8928819
Prefeitura Municipal de São Jorge do Ivaí - PR,4125308,28936129.99,3554534,11381166.61,.20248029,2.8995166
Prefeitura Municipal de São Jorge do Patrocínio - PR,4125357,40233644.38,0,16683028.69,0,2.8928819
Prefeitura Municipal de São José da Boa Vista - PR,4125407,74284595.08,639808,10764071.23,.010072461,2.8932121
Prefeitura Municipal de São José das Palmeiras - PR,4125456,18041765.72,0,7343302.08,0,2.8928819
Prefeitura Municipal de São José dos Pinhais - PR,4125506,1044875707.64,43875404,501380308.91,.080728196,2.8955271
Prefeitura Municipal de São Manoel do Paraná - PR,4125555,18646643.09,0,8719122.210000001,0,2.8928819
Prefeitura Municipal de São Mateus do Sul - PR,4125605,134839795.96,0,61974160.02,0,2.8928819
Prefeitura Municipal de São Miguel do Iguaçu - PR,4125704,137936933.29,0,59700481.45,0,2.8928819
Prefeitura Municipal de São Pedro do Iguaçu - PR,4125753,23885008.21,0,10827862.01,0,2.8928819
Prefeitura Municipal de São Pedro do Ivaí - PR,4125803,33742816.08,0,15407861.72,0,2.8928819
Prefeitura Municipal de São Pedro do Paraná - PR,4125902,21514050.43,0,8662049.859999999,0,2.8928819
Prefeitura Municipal de São Sebastião da Amoreira - PR,4126009,25568351.31,4576334,13606082.45,.38256404,2.9054172
Prefeitura Municipal de São Tomé - PR,4126108,26796412.72,542893,15374991.18,.047532875,2.8944395
Prefeitura Municipal de Sapopema - PR,4126207,23148614.69,3552037,11689648.85,.30997884,2.903039
Prefeitura Municipal de Sarandi - PR,4126256,220097628.86,20731179,113914434.32,.19523974,2.8992794
Prefeitura Municipal de Saudade do Iguaçu - PR,4126272,62983268.38,0,21905731.27,0,2.8928819
Prefeitura Municipal de Sengés - PR,4126306,56062314.97,0,26631189.3,0,2.8928819
Prefeitura Municipal de Serranópolis do Iguaçu - PR,4126355,30963181.58,0,13053872.75,0,2.8928819
Prefeitura Municipal de Sertaneja - PR,4126405,30875976.91,0,15281565.35,0,2.8928819
Prefeitura Municipal de Sertanópolis - PR,4126504,64865933.18,0,29734926.16,0,2.8928819
Prefeitura Municipal de Siqueira Campos - PR,4126603,62486978.37,0,28852348.23,0,2.8928819
Prefeitura Municipal de Sulina - PR,4126652,20120857.49,0,8810456.35,0,2.8928819
Prefeitura Municipal de Tamarana - PR,4126678,40712834.99,228258,19292745.2,.010656258,2.8932312
Prefeitura Municipal de Tamboara - PR,4126702,19958808.31,1115989,11155142.44,.12676412,2.8970356
Prefeitura Municipal de Tapejara - PR,4126801,55278855.18,4201546,29707667.65,.16430782,2.8982658
Prefeitura Municipal de Tapira - PR,4126900,20780921.16,0,12193998.34,0,2.8928819
Prefeitura Municipal de Teixeira Soares - PR,4127007,41952066.58,2993641,21964466.4,.14977491,2.8977895
Prefeitura Municipal de Telêmaco Borba - PR,4127106,244090094.02,8323290,116081182.34,.06502118,2.8950124
Prefeitura Municipal de Terra Boa - PR,4127205,63519706.79,0,24207371.66,0,2.8928819
Prefeitura Municipal de Terra Rica - PR,4127304,59204327.15,4176028,31830970.9,.15255813,2.8978808
Prefeitura Municipal de Terra Roxa - PR,4127403,77306861.81999999,0,33297805.28,0,2.8928819
Prefeitura Municipal de Tibagi - PR,4127502,103243358.13,0,44832880.85,0,2.8928819
Prefeitura Municipal de Tijucas do Sul - PR,4127601,49430371.91,2996934,25618733.93,.12586005,2.897006
Prefeitura Municipal de Toledo - PR,4127700,500152911.81,76477560,254704395.32,.31158289,2.9030914
Prefeitura Municipal de Tomazina - PR,4127809,28409565.94,2419159,11738436.17,.14511068,2.8976367
Prefeitura Municipal de Três Barras do Paraná - PR,4127858,45197927.25,7371128,22831116.94,.32955652,2.9036803
Prefeitura Municipal de Tunas do Paraná - PR,4127882,20596138.53,0,10642366.46,0,2.8928819
Prefeitura Municipal de Tuneiras do Oeste - PR,4127908,29730020.63,0,14154497.82,0,2.8928819
Prefeitura Municipal de Tupãssi - PR,4127957,35442963.49,0,16431179.17,0,2.8928819
Prefeitura Municipal de Turvo - PR,4127965,57241346.03,0,22766898.07,0,2.8928819
Prefeitura Municipal de Ubiratã - PR,4128005,87276471.16,0,43803991.11,0,2.8928819
Prefeitura Municipal de Umuarama - PR,4128104,370623252.8,21356924,167701678.23,.10524718,2.8963306
