municipio,codigo,receita_corrente,divida_consolidada,pessoal_encargos,cap_pag_div,eq1_cap_pag_div
Prefeitura Municipal de Lavras - MG,3138203,261063086.39,32715863,133998423.26,.25747412,2.9013186
Prefeitura Municipal de Leandro Ferreira - MG,3138302,14904472.68,0,8538601.869999999,0,2.8928819
Prefeitura Municipal de Leme do Prado - MG,3138351,17822636.18,0,9317721.25,0,2.8928819
Prefeitura Municipal de Leopoldina - MG,3138401,99438598.67,4850521,49752726.97,.097623751,2.8960807
Prefeitura Municipal de Liberdade - MG,3138500,16471648.79,0,6794872.33,0,2.8928819
Prefeitura Municipal de Lima Duarte - MG,3138609,38363245.42,0,18975283.1,0,2.8928819
Prefeitura Municipal de Limeira do Oeste - MG,3138625,34672180.39,0,17423444.29,0,2.8928819
Prefeitura Municipal de Lontra - MG,3138658,20273455.5,0,10384901.08,0,2.8928819
Prefeitura Municipal de Luisburgo - MG,3138674,18132490.75,0,8788608.189999999,0,2.8928819
Prefeitura Municipal de Luislândia - MG,3138682,16305692.55,0,8280600.47,0,2.8928819
Prefeitura Municipal de Luminárias - MG,3138708,16406508.64,226625,8789307.43,.02975174,2.8938568
Prefeitura Municipal de Luz - MG,3138807,50750710.21,0,24047415.89,0,2.8928819
Prefeitura Municipal de Machacalis - MG,3138906,18696605.88,0,9615708.75,0,2.8928819
Prefeitura Municipal de Machado - MG,3139003,101146451.43,2992375,48565320.2,.056909673,2.8947468
Prefeitura Municipal de Madre de Deus de Minas - MG,3139102,17207988.25,0,7813935,0,2.8928819
Prefeitura Municipal de Malacacheta - MG,3139201,41396644.73,0,23352673.02,0,2.8928819
Prefeitura Municipal de Mamonas - MG,3139250,16914802.04,0,8162983.34,0,2.8928819
Prefeitura Municipal de Manga - MG,3139300,42929338.57,0,21571486.48,0,2.8928819
Prefeitura Municipal de Manhuaçu - MG,3139409,187534190.88,15625683,99598958.25,.17769536,2.8987045
Prefeitura Municipal de Mantena - MG,3139607,64670214.59,0,39560079.35,0,2.8928819
Prefeitura Municipal de Maravilhas - MG,3139706,19484124.91,0,9849001.630000001,0,2.8928819
Prefeitura Municipal de Mar de Espanha - MG,3139805,26543280.98,0,11022905.81,0,2.8928819
Prefeitura Municipal de Maria da Fé - MG,3139904,31952647.07,0,16500540.99,0,2.8928819
Prefeitura Municipal de Mariana - MG,3140001,291885331.4,1970524,154962701.17,.014391514,2.8933535
Prefeitura Municipal de Marilac - MG,3140100,16085384.75,717247,7556116.01,.084092438,2.8956373
Prefeitura Municipal de Mário Campos - MG,3140159,33449142.98,0,14819959.75,0,2.8928819
Prefeitura Municipal de Maripá de Minas - MG,3140209,15205317.89,0,6755429.85,0,2.8928819
Prefeitura Municipal de Marliéria - MG,3140308,18611236.21,0,8916489.359999999,0,2.8928819
Prefeitura Municipal de Marmelópolis - MG,3140407,12769765.79,0,5958903.3,0,2.8928819
Prefeitura Municipal de Martinho Campos - MG,3140506,33691505.6,0,17477726.6,0,2.8928819
Prefeitura Municipal de Martins Soares - MG,3140530,20394228.8,0,9500955.310000001,0,2.8928819
Prefeitura Municipal de Mata Verde - MG,3140555,18814988.7,0,9367693.32,0,2.8928819
Prefeitura Municipal de Materlândia - MG,3140605,15992151.88,0,7825989.66,0,2.8928819
Prefeitura Municipal de Mateus Leme - MG,3140704,70716915.78,0,37882681.64,0,2.8928819
Prefeitura Municipal de Matias Barbosa - MG,3140803,48887327.59,0,23944895.86,0,2.8928819
Prefeitura Municipal de Matias Cardoso - MG,3140852,28859903.82,0,14850289.87,0,2.8928819
Prefeitura Municipal de Matipó - MG,3140902,39355173.95,0,17691714.05,0,2.8928819
Prefeitura Municipal de Mato Verde - MG,3141009,26329636.42,0,12783300.47,0,2.8928819
Prefeitura Municipal de Matozinhos - MG,3141108,78766131.18000001,0,43906524.71,0,2.8928819
Prefeitura Municipal de Matutina - MG,3141207,15354767.12,0,7365386.35,0,2.8928819
Prefeitura Municipal de Medeiros - MG,3141306,18330345.08,0,8400165.199999999,0,2.8928819
Prefeitura Municipal de Medina - MG,3141405,38957695.71,0,19458340.01,0,2.8928819
Prefeitura Municipal de Mendes Pimentel - MG,3141504,17159325.09,4021239,8485756.439999999,.46361989,2.9080732
Prefeitura Municipal de Mercês - MG,3141603,25550075.95,0,13281870.66,0,2.8928819
Prefeitura Municipal de Mesquita - MG,3141702,1410464.66,0,7589346.1,0,2.8928819
Prefeitura Municipal de Minas Novas - MG,3141801,52945201.98,6990138,28239719.25,.28293875,2.9021528
Prefeitura Municipal de Minduri - MG,3141900,16428564.42,0,8545397.630000001,0,2.8928819
Prefeitura Municipal de Mirabela - MG,3142007,31557078.71,0,16686918.29,0,2.8928819
Prefeitura Municipal de Miradouro - MG,3142106,23761975.74,0,11472103.88,0,2.8928819
Prefeitura Municipal de Miraí - MG,3142205,31832325.65,0,15952833.31,0,2.8928819
Prefeitura Municipal de Miravânia - MG,3142254,16065270.71,0,7886067.12,0,2.8928819
Prefeitura Municipal de Moeda - MG,3142304,16538206.12,0,7589104.14,0,2.8928819
Prefeitura Municipal de Moema - MG,3142403,20881961.41,0,9112780.07,0,2.8928819
Prefeitura Municipal de Monjolos - MG,3142502,13458794.38,0,6305812.65,0,2.8928819
Prefeitura Municipal de Monsenhor Paulo - MG,3142601,21928380.81,0,9648796.33,0,2.8928819
Prefeitura Municipal de Montalvânia - MG,3142700,29608472.79,0,15935359,0,2.8928819
Prefeitura Municipal de Monte Alegre de Minas - MG,3142809,71804082.34999999,0,36545804.37,0,2.8928819
Prefeitura Municipal de Monte Azul - MG,3142908,42766015.52,0,20957145.13,0,2.8928819
Prefeitura Municipal de Monte Belo - MG,3143005,31767990.27,0,18824769.59,0,2.8928819
Prefeitura Municipal de Monte Carmelo - MG,3143104,115391631.39,15333071,53563439.3,.24799481,2.9010079
Prefeitura Municipal de Monte Formoso - MG,3143153,15902088.48,0,6049064.81,0,2.8928819
Prefeitura Municipal de Monte Santo de Minas - MG,3143203,49538592.03,0,24218254.14,0,2.8928819
Prefeitura Municipal de Montes Claros - MG,3143302,792791828.42,160016067,410752102.58,.41884667,2.9066062
Prefeitura Municipal de Monte Sião - MG,3143401,61239033.06,6892011,27590817.38,.20482545,2.8995934
Prefeitura Municipal de Montezuma - MG,3143450,20318703.84,0,10135978.07,0,2.8928819
Prefeitura Municipal de Morada Nova de Minas - MG,3143500,31142735.4,0,23436215.85,0,2.8928819
Prefeitura Municipal de Morro da Garça - MG,3143609,15529599.84,276694,7187424.97,.033168089,2.8939688
Prefeitura Municipal de Morro do Pilar - MG,3143708,13348680.68,0,6562299.97,0,2.8928819
Prefeitura Municipal de Munhoz - MG,3143807,17707683.45,0,7863497.78,0,2.8928819
Prefeitura Municipal de Muriaé - MG,3143906,292780552.42,13783576,158338666.78,.10252441,2.8962414
Prefeitura Municipal de Mutum - MG,3144003,47520254.7,0,22412998.21,0,2.8928819
Prefeitura Municipal de Muzambinho - MG,3144102,51852276.25,0,27269384.04,0,2.8928819
Prefeitura Municipal de Nacip Raydan - MG,3144201,13678993.4,0,6457978.56,0,2.8928819
Prefeitura Municipal de Nanuque - MG,3144300,73614389.37,0,47905102.75,0,2.8928819
Prefeitura Municipal de Naque - MG,3144359,18188461.78,0,8206268.61,0,2.8928819
Prefeitura Municipal de Natalândia - MG,3144375,15810991.87,0,7364709.23,0,2.8928819
Prefeitura Municipal de Natércia - MG,3144409,15567990.25,0,7512747.06,0,2.8928819
Prefeitura Municipal de Nazareno - MG,3144508,32234194.44,0,12865819.18,0,2.8928819
Prefeitura Municipal de Nepomuceno - MG,3144607,54634665.86,0,29007098.64,0,2.8928819
Prefeitura Municipal de Ninheira - MG,3144656,23821458.42,0,12406349.66,0,2.8928819
Prefeitura Municipal de Nova Belém - MG,3144672,16177068.78,0,7945626.11,0,2.8928819
Prefeitura Municipal de Nova Era - MG,3144706,47303133.38,0,25850952.03,0,2.8928819
Prefeitura Municipal de Nova Lima - MG,3144805,586974805.9400001,54717255,283780302.86,.18046916,2.8987954
Prefeitura Municipal de Nova Módica - MG,3144904,15460046.98,0,7848073.66,0,2.8928819
Prefeitura Municipal de Nova Ponte - MG,3145000,61353897.79,0,31489055.07,0,2.8928819
Prefeitura Municipal de Nova Porteirinha - MG,3145059,19371827.58,0,9769973,0,2.8928819
Prefeitura Municipal de Nova Resende - MG,3145109,43214086.45,0,21519356.69,0,2.8928819
Prefeitura Municipal de Nova Serrana - MG,3145208,198092154.01,48613967,120391773.05,.62565929,2.9133828
Prefeitura Municipal de Novo Cruzeiro - MG,3145307,54411820.19,0,26715785.93,0,2.8928819
Prefeitura Municipal de Novo Oriente de Minas - MG,3145356,22932771.54,0,11637443.11,0,2.8928819
Prefeitura Municipal de Novorizonte - MG,3145372,16992972.28,0,7606259.27,0,2.8928819
Prefeitura Municipal de Olaria - MG,3145406,14358514.09,0,7391337.67,0,2.8928819
Prefeitura Municipal de Olhos-d'Água - MG,3145455,19103775.24,0,9972542.76,0,2.8928819
Prefeitura Municipal de Olímpio Noronha - MG,3145505,15057393.7,0,7903228,0,2.8928819
Prefeitura Municipal de Oliveira - MG,3145604,105896481.89,679967,58120456.32,.01423239,2.8933482
Prefeitura Municipal de Oliveira Fortes - MG,3145703,12662830.92,0,5947926.06,0,2.8928819
Prefeitura Municipal de Onça de Pitangui - MG,3145802,16164812.47,0,8584851.23,0,2.8928819
Prefeitura Municipal de Oratórios - MG,3145851,18634057.07,0,7512653.85,0,2.8928819
Prefeitura Municipal de Orizânia - MG,3145877,18966078.06,0,9814825.550000001,0,2.8928819
Prefeitura Municipal de Ouro Branco - MG,3145901,118390547.92,8053721,64869204.39,.15047681,2.8978126
Prefeitura Municipal de Ouro Fino - MG,3146008,73250186.26000001,0,32986865.47,0,2.8928819
Prefeitura Municipal de Ouro Preto - MG,3146107,269168665.89,13217570,143385007.53,.10508177,2.8963251
Prefeitura Municipal de Ouro Verde de Minas - MG,3146206,16787133.83,2229613,8437148.74,.26701999,2.9016314
Prefeitura Municipal de Padre Carvalho - MG,3146255,17075416.53,0,8528528.289999999,0,2.8928819
Prefeitura Municipal de Padre Paraíso - MG,3146305,40859528.3,0,20645754.35,0,2.8928819
Prefeitura Municipal de Paineiras - MG,3146404,16228446.16,5326955,9788479.039999999,.82717115,2.9199855
Prefeitura Municipal de Pains - MG,3146503,34790208.3,0,17705709.07,0,2.8928819
Prefeitura Municipal de Pai Pedro - MG,3146552,18553535.02,0,9474033.67,0,2.8928819
Prefeitura Municipal de Paiva - MG,3146602,12228731.43,0,5927961.49,0,2.8928819
Prefeitura Municipal de Palma - MG,3146701,17427706.21,0,8145593.46,0,2.8928819
Prefeitura Municipal de Palmópolis - MG,3146750,15284598.93,0,8527165.83,0,2.8928819
Prefeitura Municipal de Papagaios - MG,3146909,34767220.11,0,16999066,0,2.8928819
Prefeitura Municipal de Paracatu - MG,3147006,300888141.32,15704026,166248141.02,.11663715,2.8967037
Prefeitura Municipal de Pará de Minas - MG,3147105,227650215.8,38288490,119638060.61,.35448316,2.9044971
Prefeitura Municipal de Paraguaçu - MG,3147204,49771412.63,0,28127900.75,0,2.8928819
Prefeitura Municipal de Paraisópolis - MG,3147303,44791173.41,0,21752391.9,0,2.8928819
Prefeitura Municipal de Paraopeba - MG,3147402,55401185.32,0,35939100.5,0,2.8928819
Prefeitura Municipal de Passabém - MG,3147501,12161067.14,0,5184060.77,0,2.8928819
Prefeitura Municipal de Passa Quatro - MG,3147600,39202136.13,7040091,24950820.21,.49399585,2.9090686
Prefeitura Municipal de Passa Tempo - MG,3147709,25104234.42,0,12859472.19,0,2.8928819
Prefeitura Municipal de Passa-Vinte - MG,3147808,13825245.28,0,6181669.62,0,2.8928819
Prefeitura Municipal de Passos - MG,3147907,239436128.59,33583773,114532371.56,.26887721,2.9016922
Prefeitura Municipal de Patis - MG,3147956,17798947.28,0,10150386.39,0,2.8928819
Prefeitura Municipal de Patos de Minas - MG,3148004,445685724.18,22958409,214008319.92,.099096455,2.8961289
Prefeitura Municipal de Patrocínio - MG,3148103,289275937.03,85810349,130992373.51,.54213053,2.9106457
Prefeitura Municipal de Patrocínio do Muriaé - MG,3148202,16221310.16,251384,8540664.630000001,.03272954,2.8939543
Prefeitura Municipal de Paula Cândido - MG,3148301,22202134.45,0,8232733.05,0,2.8928819
Prefeitura Municipal de Paulistas - MG,3148400,17402057.33,0,9286767.189999999,0,2.8928819
Prefeitura Municipal de Pavão - MG,3148509,19012776.54,0,8914043.970000001,0,2.8928819
Prefeitura Municipal de Peçanha - MG,3148608,35931502.28,0,17448722.79,0,2.8928819
Prefeitura Municipal de Pedra Azul - MG,3148707,49201447.14,0,25799481.79,0,2.8928819
Prefeitura Municipal de Pedra Bonita - MG,3148756,18733019.65,0,8911282.640000001,0,2.8928819
Prefeitura Municipal de Pedra do Anta - MG,3148806,15038480.44,0,7281854.58,0,2.8928819
Prefeitura Municipal de Pedra do Indaiá - MG,3148905,16927484.01,635879,8786340.49,.078106843,2.8954413
Prefeitura Municipal de Pedra Dourada - MG,3149002,15249222.18,0,7583419.33,0,2.8928819
Prefeitura Municipal de Pedralva - MG,3149101,24124625.62,0,12068999.65,0,2.8928819
Prefeitura Municipal de Pedras de Maria da Cruz - MG,3149150,23305428.86,0,12263491.61,0,2.8928819
Prefeitura Municipal de Pedrinópolis - MG,3149200,21580281.3,0,11569091.69,0,2.8928819
Prefeitura Municipal de Pedro Leopoldo - MG,3149309,153095952.39,13377945,84283596.18000001,.19441196,2.8992522
Prefeitura Municipal de Pedro Teixeira - MG,3149408,13068055.16,0,6229504.76,0,2.8928819
Prefeitura Municipal de Pequeri - MG,3149507,16073709.89,0,7180330.81,0,2.8928819
Prefeitura Municipal de Pequi - MG,3149606,16251027.25,802282,8455148.27,.10291104,2.8962541
Prefeitura Municipal de Perdigão - MG,3149705,30723866.16,0,16055415.29,0,2.8928819
Prefeitura Municipal de Perdizes - MG,3149804,67010649.69,0,30966801.17,0,2.8928819
Prefeitura Municipal de Perdões - MG,3149903,54967392.3,0,29775719.11,0,2.8928819
Prefeitura Municipal de Periquito - MG,3149952,20937504.01,0,10172347.96,0,2.8928819
Prefeitura Municipal de Pescador - MG,3150000,14881820.27,0,7546672.32,0,2.8928819
Prefeitura Municipal de Piau - MG,3150109,14798157.13,0,7091168.6,0,2.8928819
Prefeitura Municipal de Piedade de Caratinga - MG,3150158,20707655.71,0,8586109.210000001,0,2.8928819
Prefeitura Municipal de Piedade de Ponte Nova - MG,3150208,15573267.55,0,7916953.75,0,2.8928819
Prefeitura Municipal de Piedade do Rio Grande - MG,3150307,14995204.05,0,7402898.65,0,2.8928819
Prefeitura Municipal de Piedade dos Gerais - MG,3150406,16797596.36,0,7251886.78,0,2.8928819
Prefeitura Municipal de Pimenta - MG,3150505,25733788.46,0,12781441.89,0,2.8928819
Prefeitura Municipal de Pingo-d'Água - MG,3150539,17412096.49,0,8154457.35,0,2.8928819
Prefeitura Municipal de Pintópolis - MG,3150570,21090364.61,0,10277604.61,0,2.8928819
Prefeitura Municipal de Piracema - MG,3150604,20226359.59,0,11268690.94,0,2.8928819
Prefeitura Municipal de Pirajuba - MG,3150703,26491238,0,13034000.49,0,2.8928819
Prefeitura Municipal de Piranga - MG,3150802,34570553.25,609645,18896832.09,.038895994,2.8941565
Prefeitura Municipal de Piranguçu - MG,3150901,15557769.12,0,6771900.55,0,2.8928819
Prefeitura Municipal de Piranguinho - MG,3151008,20334876.67,0,9520276.23,0,2.8928819
Prefeitura Municipal de Pirapetinga - MG,3151107,31888974.73,5754810,16324811.78,.36974749,2.9049973
Prefeitura Municipal de Pirapora - MG,3151206,162650418.62,37180237,97069666.84,.56693828,2.9114585
Prefeitura Municipal de Piraúba - MG,3151305,24788204.84,0,12706462.6,0,2.8928819
Prefeitura Municipal de Pitangui - MG,3151404,55257795.17,0,25899693.23,0,2.8928819
Prefeitura Municipal de Piumhi - MG,3151503,95154741.3,0,42828131.36,0,2.8928819
Prefeitura Municipal de Planura - MG,3151602,38616707.27,0,19669091.03,0,2.8928819
Prefeitura Municipal de Poço Fundo - MG,3151701,38821860.02,0,20336674.15,0,2.8928819
Prefeitura Municipal de Poços de Caldas - MG,3151800,685538993.33,195505752,318543703.16,.53272003,2.9103374
Prefeitura Municipal de Pocrane - MG,3151909,18968133.35,0,9227573.5,0,2.8928819
Prefeitura Municipal de Pompéu - MG,3152006,80224231.47,22589618,42089033.04,.59235609,2.9122915
Prefeitura Municipal de Ponte Nova - MG,3152105,179035630.32,8942296,80794301.64,.091023766,2.8958645
Prefeitura Municipal de Ponto Chique - MG,3152131,14957591.94,0,7032992.41,0,2.8928819
Prefeitura Municipal de Ponto dos Volantes - MG,3152170,28833762.27,0,14583693.64,0,2.8928819
Prefeitura Municipal de Porteirinha - MG,3152204,69237835.22,0,27633575.72,0,2.8928819
Prefeitura Municipal de Porto Firme - MG,3152303,20566933.23,0,9219927.539999999,0,2.8928819
Prefeitura Municipal de Poté - MG,3152402,32196809.72,0,16116635.09,0,2.8928819
Prefeitura Municipal de Pouso Alegre - MG,3152501,569696744.77,58388483,251241957.54,.18334937,2.8988898
Prefeitura Municipal de Pouso Alto - MG,3152600,21464604.52,2581088,10677146.9,.2392675,2.900722
Prefeitura Municipal de Prados - MG,3152709,20622486.04,0,10014302.74,0,2.8928819
Prefeitura Municipal de Prata - MG,3152808,78734181.52,0,36171180.68,0,2.8928819
Prefeitura Municipal de Pratápolis - MG,3152907,23967273.86,0,11519634.7,0,2.8928819
Prefeitura Municipal de Pratinha - MG,3153004,19441828.43,0,10266792.9,0,2.8928819
Prefeitura Municipal de Presidente Bernardes - MG,3153103,15778134.91,0,9057550.35,0,2.8928819
Prefeitura Municipal de Presidente Juscelino - MG,3153202,15477292.73,1094814,7797903.58,.14256525,2.8975532
Prefeitura Municipal de Presidente Kubitschek - MG,3153301,14276582.75,0,7411968.31,0,2.8928819
Prefeitura Municipal de Presidente Olegário - MG,3153400,54477139.92,0,34256546.67,0,2.8928819
Prefeitura Municipal de Alto Jequitibá - MG,3153509,18170672.93,0,8574344.619999999,0,2.8928819
Prefeitura Municipal de Prudente de Morais - MG,3153608,25317517.03,0,12932280.56,0,2.8928819
Prefeitura Municipal de Quartel Geral - MG,3153707,16941017.57,0,8642754.060000001,0,2.8928819
Prefeitura Municipal de Queluzito - MG,3153806,13065500.84,0,5824739.6,0,2.8928819
Prefeitura Municipal de Raposos - MG,3153905,33206170.57,0,16563316.54,0,2.8928819
Prefeitura Municipal de Raul Soares - MG,3154002,46721984.1,0,20796362.65,0,2.8928819
Prefeitura Municipal de Recreio - MG,3154101,24638503.61,0,12694272.95,0,2.8928819
Prefeitura Municipal de Reduto - MG,3154150,17381649.46,1444232,8017559.86,.15423091,2.8979356
Prefeitura Municipal de Resende Costa - MG,3154200,26801145.59,0,13763127.5,0,2.8928819
Prefeitura Municipal de Resplendor - MG,3154309,42963867.36,0,21002705.93,0,2.8928819
Prefeitura Municipal de Ressaquinha - MG,3154408,16939789.62,0,9316236.439999999,0,2.8928819
Prefeitura Municipal de Riachinho - MG,3154457,20962627.53,0,10691317.42,0,2.8928819
Prefeitura Municipal de Riacho dos Machados - MG,3154507,26546849.51,625104,13195989.49,.046821255,2.8944161
Prefeitura Municipal de Ribeirão das Neves - MG,3154606,408051190.7,228103248,236815677.66,1.3321024,2.9365304
Prefeitura Municipal de Ribeirão Vermelho - MG,3154705,14920213.42,1010752,7526188.61,.13669848,2.897361
Prefeitura Municipal de Rio Acima - MG,3154804,53912603.67,0,28645143.44,0,2.8928819
Prefeitura Municipal de Rio Casca - MG,3154903,34531999.84,0,16957830,0,2.8928819
Prefeitura Municipal de Rio Doce - MG,3155009,23742371.94,0,8797094.09,0,2.8928819
Prefeitura Municipal de Rio do Prado - MG,3155108,15602885.38,0,8013079.99,0,2.8928819
Prefeitura Municipal de Rio Espera - MG,3155207,15574789.44,0,7979252.63,0,2.8928819
Prefeitura Municipal de Rio Manso - MG,3155306,16246546.38,0,8353505.45,0,2.8928819
Prefeitura Municipal de Rio Novo - MG,3155405,20886252.48,0,10295428.94,0,2.8928819
Prefeitura Municipal de Rio Paranaíba - MG,3155504,52540604.09,0,27431348.34,0,2.8928819
Prefeitura Municipal de Rio Pardo de Minas - MG,3155603,55812128.45,0,29379333.84,0,2.8928819
Prefeitura Municipal de Rio Piracicaba - MG,3155702,48194613.98,0,20792726.62,0,2.8928819
Prefeitura Municipal de Rio Pomba - MG,3155801,39280896.89,0,17116599.87,0,2.8928819
Prefeitura Municipal de Rio Preto - MG,3155900,17687964.14,0,7665741.49,0,2.8928819
Prefeitura Municipal de Rio Vermelho - MG,3156007,27506366.81,0,13148323.32,0,2.8928819
Prefeitura Municipal de Ritápolis - MG,3156106,14446396.3,0,7078239.28,0,2.8928819
Prefeitura Municipal de Rochedo de Minas - MG,3156205,13600736.35,0,7397672.66,0,2.8928819
Prefeitura Municipal de Rodeiro - MG,3156304,20187338.75,0,8490915.869999999,0,2.8928819
Prefeitura Municipal de Romaria - MG,3156403,19171589.79,0,7783280,0,2.8928819
Prefeitura Municipal de Rosário da Limeira - MG,3156452,18410845.45,0,9643024.619999999,0,2.8928819
Prefeitura Municipal de Rubelita - MG,3156502,17768362.01,0,9074979.98,0,2.8928819
Prefeitura Municipal de Rubim - MG,3156601,24748871.6,0,12500285.04,0,2.8928819
Prefeitura Municipal de Sabará - MG,3156700,253912270.94,55049436,137457007.08,.47270888,2.908371
Prefeitura Municipal de Sabinópolis - MG,3156809,38187405.1,0,20769781.18,0,2.8928819
Prefeitura Municipal de Sacramento - MG,3156908,108884780.77,2430617,41655616.72,.036154207,2.8940666
Prefeitura Municipal de Salinas - MG,3157005,74294595.48999999,0,42405656.92,0,2.8928819
Prefeitura Municipal de Salto da Divisa - MG,3157104,22332839,0,11753600.82,0,2.8928819
Prefeitura Municipal de Santa Bárbara - MG,3157203,97010121.22,0,47179353.05,0,2.8928819
Prefeitura Municipal de Santa Bárbara do Leste - MG,3157252,16430618.38,0,9052697.67,0,2.8928819
Prefeitura Municipal de Santa Bárbara do Monte Verde - MG,3157278,15575690.52,0,6222980.73,0,2.8928819
Prefeitura Municipal de Santa Bárbara do Tugúrio - MG,3157302,15303368.12,0,8087005.69,0,2.8928819
Prefeitura Municipal de Santa Cruz de Minas - MG,3157336,16101154.99,0,7582161.32,0,2.8928819
Prefeitura Municipal de Santa Cruz de Salinas - MG,3157377,15130417.69,0,6857161.74,0,2.8928819
Prefeitura Municipal de Santa Cruz do Escalvado - MG,3157401,23582369.11,0,8882005.15,0,2.8928819
Prefeitura Municipal de Santa Efigênia de Minas - MG,3157500,14718567.68,0,7730335.74,0,2.8928819
Prefeitura Municipal de Santa Fé de Minas - MG,3157609,15172078.82,0,6885815.64,0,2.8928819
Prefeitura Municipal de Santa Helena de Minas - MG,3157658,16125102.52,0,7753961.28,0,2.8928819
Prefeitura Municipal de Santa Juliana - MG,3157708,51337980.54,0,24012661.13,0,2.8928819
Prefeitura Municipal de Santa Luzia - MG,3157807,386842784.56,95087862,175657981.11,.45025903,2.9076355
Prefeitura Municipal de Santa Margarida - MG,3157906,32523706.5,1540830,14405198.74,.085041769,2.8956685
Prefeitura Municipal de Santa Maria de Itabira - MG,3158003,24669668.12,37195,12537015.06,.0030656939,2.8929825
Prefeitura Municipal de Santa Maria do Salto - MG,3158102,15423023.87,0,7714610.19,0,2.8928819
Prefeitura Municipal de Santa Maria do Suaçuí - MG,3158201,30764951.26,0,15077463.14,0,2.8928819
Prefeitura Municipal de Santana da Vargem - MG,3158300,20122963.91,529120,10139099.74,.052997515,2.8946185
Prefeitura Municipal de Santana de Cataguases - MG,3158409,15132731.18,0,7827151.92,0,2.8928819
Prefeitura Municipal de Santana de Pirapama - MG,3158508,17899784.94,0,9438239.02,0,2.8928819
Prefeitura Municipal de Santana do Deserto - MG,3158607,15691714.46,0,7411745.42,0,2.8928819
Prefeitura Municipal de Santana do Garambéu - MG,3158706,13518545.11,0,6350169.37,0,2.8928819
Prefeitura Municipal de Santana do Jacaré - MG,3158805,14912788.14,0,7231735.13,0,2.8928819
Prefeitura Municipal de Santana do Manhuaçu - MG,3158904,18834040.01,0,9722544.65,0,2.8928819
Prefeitura Municipal de Santana do Paraíso - MG,3158953,62991450.93,0,29939862.99,0,2.8928819
Prefeitura Municipal de Santana do Riacho - MG,3159001,17140726.9,0,8145280.44,0,2.8928819
Prefeitura Municipal de Santana dos Montes - MG,3159100,13846607.09,1855231,6126791.88,.24032065,2.9007564
Prefeitura Municipal de Santa Rita de Caldas - MG,3159209,22274173.88,0,10719733.72,0,2.8928819
Prefeitura Municipal de Santa Rita de Jacutinga - MG,3159308,16664479.12,0,7747774.14,0,2.8928819
Prefeitura Municipal de Santa Rita de Minas - MG,3159357,16154245.62,0,8752363.640000001,0,2.8928819
Prefeitura Municipal de Santa Rita de Ibitipoca - MG,3159407,14462189.26,140293,7247462.49,.019445365,2.8935192
Prefeitura Municipal de Santa Rita do Itueto - MG,3159506,17324617.9,0,8718103.859999999,0,2.8928819
Prefeitura Municipal de Santa Rita do Sapucaí - MG,3159605,89433944.09999999,3359001,42747387.56,.071947925,2.8952394
Prefeitura Municipal de Santa Rosa da Serra - MG,3159704,16154548.17,0,9283213.539999999,0,2.8928819
Prefeitura Municipal de Santa Vitória - MG,3159803,126729414.52,0,73670131.54000001,0,2.8928819
Prefeitura Municipal de Santo Antônio do Amparo - MG,3159902,49771362.29,0,19976771.92,0,2.8928819
Prefeitura Municipal de Santo Antônio do Aventureiro - MG,3160009,15077130.69,0,7168127.62,0,2.8928819
Prefeitura Municipal de Santo Antônio do Grama - MG,3160108,17985853.96,0,8056868.93,0,2.8928819
Prefeitura Municipal de Santo Antônio do Itambé - MG,3160207,15623953.57,0,7812773.01,0,2.8928819
Prefeitura Municipal de Santo Antônio do Jacinto - MG,3160306,24754979.9,0,12422539.2,0,2.8928819
Prefeitura Municipal de Santo Antônio do Monte - MG,3160405,69116634.5,1612079,39311393.43,.054087099,2.8946543
Prefeitura Municipal de Santo Antônio do Retiro - MG,3160454,20697658.91,0,9697671.99,0,2.8928819
Prefeitura Municipal de Santo Antônio do Rio Abaixo - MG,3160504,12054111.03,0,5862415.53,0,2.8928819
Prefeitura Municipal de Santo Hipólito - MG,3160603,14263617.54,712597,7203363.04,.10093078,2.8961892
Prefeitura Municipal de Santos Dumont - MG,3160702,86858112.31,0,44301267.41,0,2.8928819
Prefeitura Municipal de São Bento Abade - MG,3160801,16640657.33,369091,8215290.22,.043807112,2.8943174
Prefeitura Municipal de São Brás do Suaçuí - MG,3160900,19742626.99,0,9957225.029999999,0,2.8928819
Prefeitura Municipal de São Domingos das Dores - MG,3160959,17329813.44,106109,8589650.550000001,.012140391,2.8932798
Prefeitura Municipal de São Domingos do Prata - MG,3161007,37422203.98,0,20049358.73,0,2.8928819
Prefeitura Municipal de São Félix de Minas - MG,3161056,16059109.8,0,8038417.3,0,2.8928819
Prefeitura Municipal de São Francisco - MG,3161106,99369390.79000001,25621380,54486987.77,.5708558,2.911587
Prefeitura Municipal de São Francisco de Paula - MG,3161205,18613511.73,0,9060583.73,0,2.8928819
Prefeitura Municipal de São Francisco de Sales - MG,3161304,26553132.87,0,11745990.82,0,2.8928819
Prefeitura Municipal de São Francisco do Glória - MG,3161403,19435609.63,0,10475527.33,0,2.8928819
Prefeitura Municipal de São Geraldo - MG,3161502,23380943.73,0,11327596.11,0,2.8928819
Prefeitura Municipal de São Geraldo da Piedade - MG,3161601,15692166.4,0,6940934.62,0,2.8928819
