municipio,codigo,receita_corrente,divida_consolidada,pessoal_encargos,cap_pag_div,eq1_cap_pag_div
Prefeitura Municipal de Lastro - PB,2508406,15208786.36,5733934,6986031.23,.69732517,2.915731
Prefeitura Municipal de Livramento - PB,2508505,19998090.1,5865899,11101744.06,.65936047,2.9144869
Prefeitura Municipal de Logradouro - PB,2508554,15786962.91,2866094,7981802.37,.36720499,2.9049139
Prefeitura Municipal de Lucena - PB,2508604,37625431.68,20544602,27222749.5,1.9749331,2.9575939
Prefeitura Municipal de Mãe d'Água - PB,2508703,15083196.89,0,8299489.49,0,2.8928819
Prefeitura Municipal de Malta - PB,2508802,18638464.17,5644625,9253568.16,.60145843,2.9125898
Prefeitura Municipal de Mamanguape - PB,2508901,93234293.83,67005515,51465669.08,1.6042069,2.9454465
Prefeitura Municipal de Manaíra - PB,2509008,23248615.26,0,13071510.15,0,2.8928819
Prefeitura Municipal de Marcação - PB,2509057,21663423.78,10070291,12447852.79,1.0927473,2.9286876
Prefeitura Municipal de Mari - PB,2509107,43381257.29,24235927,27656274.69,1.5412371,2.943383
Prefeitura Municipal de Marizópolis - PB,2509156,22026642.86,870861,11576709.35,.08333651,2.8956125
Prefeitura Municipal de Massaranduba - PB,2509206,32793190.95,10802748,18914134.77,.77834886,2.9183857
Prefeitura Municipal de Mataraca - PB,2509305,32942803.56,6295793,19377311.5,.46410355,2.9080892
Prefeitura Municipal de Matinhas - PB,2509339,16530340.29,4489473,8483049.800000001,.5578863,2.9111619
Prefeitura Municipal de Mato Grosso - PB,2509370,12378255.36,2136487,6656267.33,.37338194,2.9051163
Prefeitura Municipal de Maturéia - PB,2509396,19308330.83,727031,10686591.36,.084325328,2.8956449
Prefeitura Municipal de Mogeiro - PB,2509404,31358584.22,17762818,15518727.98,1.1214002,2.9296265
Prefeitura Municipal de Montadas - PB,2509503,18265109.26,1179883,12550781.67,.20647801,2.8996475
Prefeitura Municipal de Monte Horebe - PB,2509602,16002812.32,8288908,8000520.48,1.0358168,2.9268222
Prefeitura Municipal de Monteiro - PB,2509701,76901055.93000001,19191073,47517749.13,.65312845,2.9142828
Prefeitura Municipal de Mulungu - PB,2509800,0,18532911,0,,
Prefeitura Municipal de Natuba - PB,2509909,27666258.26,9057538,17444557.17,.8861087,2.9219167
Prefeitura Municipal de Nazarezinho - PB,2510006,20020947.42,3265787,13902812.53,.53378803,2.9103725
Prefeitura Municipal de Nova Floresta - PB,2510105,22054752.29,10573041,13775050.96,1.2769834,2.9347243
Prefeitura Municipal de Nova Olinda - PB,2510204,18876104.3,0,10097838.34,0,2.8928819
Prefeitura Municipal de Nova Palmeira - PB,2510303,15960119.29,3982004,11837084.2,.96579432,2.9245279
Prefeitura Municipal de Olho d'Água - PB,2510402,17898150.59,1197290,10909074.17,.17130876,2.8984952
Prefeitura Municipal de Olivedos - PB,2510501,15268667.45,1790435,8025703.02,.24719644,2.9009817
Prefeitura Municipal de Ouro Velho - PB,2510600,13761720.74,871007,6950483.15,.12787794,2.8970721
Prefeitura Municipal de Parari - PB,2510659,12576600.79,538358,5717004.46,.078482464,2.8954535
Prefeitura Municipal de Passagem - PB,2510709,14348192.58,6834940,6533857.9,.87466693,2.9215419
Prefeitura Municipal de Patos - PB,2510808,208089190.17,55001688,167660959.31,1.3604772,2.9374602
Prefeitura Municipal de Paulista - PB,2510907,31058499.2,3470253,16463950.03,.23777734,2.9006732
Prefeitura Municipal de Pedra Branca - PB,2511004,15780164.63,0,6541383,0,2.8928819
Prefeitura Municipal de Pedra Lavrada - PB,2511103,23132395.39,22659859,16586047.2,3.4614503,3.0063021
Prefeitura Municipal de Pedras de Fogo - PB,2511202,80834474.95999999,32189176,54234980.27,1.2101424,2.9325342
Prefeitura Municipal de Piancó - PB,2511301,52232343.6,41668308,31392632.81,1.9994667,2.9583976
Prefeitura Municipal de Picuí - PB,2511400,46575636.95,295901,32615801.07,.021196596,2.8935764
Prefeitura Municipal de Pilar - PB,2511509,26980985.17,19709126,18552000.63,2.3382564,2.9694986
Prefeitura Municipal de Pilões - PB,2511608,19472268.62,2872476,14488527.85,.57636946,2.9117677
Prefeitura Municipal de Pilõezinhos - PB,2511707,16277516.91,3524045,11111701.25,.68218559,2.9152348
Prefeitura Municipal de Pirpirituba - PB,2511806,24602778.23,0,14685667.91,0,2.8928819
Prefeitura Municipal de Pocinhos - PB,2512002,45574215.18,34299666,27730232.87,1.9221979,2.9558659
Prefeitura Municipal de Poço Dantas - PB,2512036,18750414.7,2196697,10364998.58,.26196638,2.9014657
Prefeitura Municipal de Poço de José de Moura - PB,2512077,20086595.32,12175,11052846.37,.001347724,2.8929262
Prefeitura Municipal de Pombal - PB,2512101,70957512.61,24989066,42471913.42,.87725258,2.9216266
Prefeitura Municipal de Prata - PB,2512200,15972904.86,621221,7396928.67,.072437353,2.8952556
Prefeitura Municipal de Princesa Isabel - PB,2512309,48977316.59,26557203,25424560.03,1.1275624,2.9298284
Prefeitura Municipal de Puxinanã - PB,2512408,29562519.14,18712847,18013612,1.6203133,2.9459741
Prefeitura Municipal de Queimadas - PB,2512507,98162899.45,18795833,64878372.54,.5647018,2.9113853
Prefeitura Municipal de Quixaba - PB,2512606,13684794.94,1972664,7585965.94,.32344964,2.9034803
Prefeitura Municipal de Remígio - PB,2512705,42414950.85,6599283,27666790.34,.44746482,2.9075439
Prefeitura Municipal de Pedro Régis - PB,2512721,17130916.67,2950124,11009704.33,.48195094,2.9086738
Prefeitura Municipal de Riachão - PB,2512747,16302278.83,1892574,9268325.109999999,.26906261,2.9016981
Prefeitura Municipal de Riachão do Bacamarte - PB,2512754,16606088.12,3397606,10054521.11,.51859438,2.9098744
Prefeitura Municipal de Riachão do Poço - PB,2512762,17442586.77,360590,10427992.24,.051405679,2.8945663
Prefeitura Municipal de Riacho de Santo Antônio - PB,2512788,13903012.04,1396436,7042162.98,.20353691,2.8995512
Prefeitura Municipal de Riacho dos Cavalos - PB,2512804,22094197.42,0,11539781.54,0,2.8928819
Prefeitura Municipal de Rio Tinto - PB,2512903,51821942.05,27365071,33151338.54,1.4656768,2.9409072
Prefeitura Municipal de Salgadinho - PB,2513000,15259537.16,1554066,6483432.56,.17707925,2.8986843
Prefeitura Municipal de Salgado de São Félix - PB,2513109,29710455.18,26182173,17539232.07,2.1511538,2.9633679
Prefeitura Municipal de Santa Cecília - PB,2513158,18755588.9,861037,11000633.21,.11103055,2.8965201
Prefeitura Municipal de Santa Cruz - PB,2513208,18229582.75,12715111,11408745.22,1.8641568,2.953964
Prefeitura Municipal de Santa Helena - PB,2513307,18761377.33,117185,10846480.06,.014805625,2.8933671
Prefeitura Municipal de Santa Inês - PB,2513356,13989353.22,0,7484581.6,0,2.8928819
Prefeitura Municipal de Santa Luzia - PB,2513406,34890844.75,2471403,25909271.84,.27516371,2.9018981
Prefeitura Municipal de Santana de Mangueira - PB,2513505,16703243.4,12166640,10157498.36,1.8587097,2.9537857
Prefeitura Municipal de Santana dos Garrotes - PB,2513604,17942913.91,4433079,10322892.71,.58176726,2.9119444
Prefeitura Municipal de Joca Claudino - PB,2513653,15831612.84,15545576,8199037.87,2.0367408,2.959619
Prefeitura Municipal de Santa Rita - PB,2513703,235439634.45,77299966,160171303.44,1.0269918,2.926533
Prefeitura Municipal de Santa Teresinha - PB,2513802,17176352.59,4289466,9875735.609999999,.58754843,2.9121339
Prefeitura Municipal de Santo André - PB,2513851,14874492.49,1474587,6948008.1,.18603292,2.8989775
Prefeitura Municipal de São Bento - PB,2513901,82651748.79000001,0,51509266.11,0,2.8928819
Prefeitura Municipal de São Bentinho - PB,2513927,16051784.79,2598097,9258569.449999999,.38245469,2.9054136
Prefeitura Municipal de São Domingos do Cariri - PB,2513943,13422318.59,0,6192079.02,0,2.8928819
Prefeitura Municipal de São Domingos - PB,2513968,14635889.85,0,7316555.16,0,2.8928819
Prefeitura Municipal de São Francisco - PB,2513984,14771082.53,0,7258008.42,0,2.8928819
Prefeitura Municipal de São João do Cariri - PB,2514008,16570757.43,0,8623579.279999999,0,2.8928819
Prefeitura Municipal de São João do Tigre - PB,2514107,16845934.11,0,8243949.67,0,2.8928819
Prefeitura Municipal de São José da Lagoa Tapada - PB,2514206,18953706.59,0,9640332.85,0,2.8928819
Prefeitura Municipal de São José de Caiana - PB,2514305,16818817.85,8013387,10416611.27,1.2516602,2.9338946
Prefeitura Municipal de São José de Espinharas - PB,2514404,17120597.4,7700310,8895143.43,.93615621,2.9235566
Prefeitura Municipal de São José dos Ramos - PB,2514453,18920782.5,2269154,11760501.04,.31690848,2.903266
Prefeitura Municipal de São José de Piranhas - PB,2514503,41896148.03,0,23148675.28,0,2.8928819
Prefeitura Municipal de São José de Princesa - PB,2514552,14098732.33,2125066,5634177.23,.25105467,2.9011083
Prefeitura Municipal de São José do Bonfim - PB,2514602,15105589.07,3109113,5609931.79,.32742473,2.9036105
Prefeitura Municipal de São José do Brejo do Cruz - PB,2514651,13937895.36,0,7680091.99,0,2.8928819
Prefeitura Municipal de São José do Sabugi - PB,2514701,16984707.73,7163184,8725740.74,.86732203,2.9213011
Prefeitura Municipal de São José dos Cordeiros - PB,2514800,13700467.23,3867781,6133794.82,.51116008,2.909631
Prefeitura Municipal de São Mamede - PB,2514909,24051165.11,6767487,11305509.07,.5309642,2.9102798
Prefeitura Municipal de São Miguel de Taipu - PB,2515005,18247786.3,0,9727894.25,0,2.8928819
Prefeitura Municipal de São Sebastião de Lagoa de Roça - PB,2515104,27757095.87,735169,19310071.44,.087032899,2.8957338
Prefeitura Municipal de São Sebastião do Umbuzeiro - PB,2515203,15398122.04,0,7359241.67,0,2.8928819
Prefeitura Municipal de Sapé - PB,2515302,102000142.91,57640137,74059892.54000001,2.0629785,2.9604788
Prefeitura Municipal de São Vicente do Seridó - PB,2515401,24837993.9,17587295,12452551.76,1.4199973,2.9394104
Prefeitura Municipal de Serra Branca - PB,2515500,32271479.19,6445295,20604694.25,.55244827,2.9109838
Prefeitura Municipal de Serra da Raiz - PB,2515609,15084305.19,6725755,8327960.5,.99547243,2.9255002
Prefeitura Municipal de Serra Grande - PB,2515708,14743477.98,0,7044310.69,0,2.8928819
Prefeitura Municipal de Serra Redonda - PB,2515807,16872953.74,11890969,10448432.31,1.8508724,2.9535289
Prefeitura Municipal de Serraria - PB,2515906,16611769.47,0,9726463.970000001,0,2.8928819
Prefeitura Municipal de Sertãozinho - PB,2515930,17392310.48,2054440,10062501.96,.28028563,2.902066
Prefeitura Municipal de Sobrado - PB,2515971,21434842.99,0,12716516.12,0,2.8928819
Prefeitura Municipal de Solânea - PB,2516003,51669059.25,28653402,29269491.29,1.2791944,2.9347968
Prefeitura Municipal de Soledade - PB,2516102,34582981.09,0,24539832.18,0,2.8928819
Prefeitura Municipal de Sossêgo - PB,2516151,15712328.82,515254,8917521.609999999,.075830556,2.8953667
Prefeitura Municipal de Sousa - PB,2516201,134468237.53,24768387,73108348.56,.40365762,2.9061084
Prefeitura Municipal de Sumé - PB,2516300,48037063.75,267531,25697341.01,.011975574,2.8932743
Prefeitura Municipal de Tacima - PB,2516409,24519474.62,0,13841639.46,0,2.8928819
Prefeitura Municipal de Taperoá - PB,2516508,31507070.96,11414033,17987527.29,.84426171,2.9205456
Prefeitura Municipal de Tavares - PB,2516607,33290775.49,0,20837330.33,0,2.8928819
Prefeitura Municipal de Teixeira - PB,2516706,34311729.48,15919770,18765336.62,1.024017,2.9264355
Prefeitura Municipal de Tenório - PB,2516755,15130967.32,197194,6743972.93,.023511879,2.8936524
Prefeitura Municipal de Triunfo - PB,2516805,18468915.17,11928077,11183024.71,1.6371474,2.9465258
Prefeitura Municipal de Uiraúna - PB,2516904,32459755.41,20523761,17891418.2,1.4087923,2.9390433
Prefeitura Municipal de Umbuzeiro - PB,2517001,23076920.43,10079921,14366031.95,1.1571634,2.9307983
Prefeitura Municipal de Várzea - PB,2517100,14117569.09,4375332,7003809.7,.61505198,2.9130352
Prefeitura Municipal de Vieirópolis - PB,2517209,16948556.64,1215430,7762200.52,.13230817,2.8972173
Prefeitura Municipal de Zabelê - PB,2517407,13840721.74,0,6450195.52,0,2.8928819
Prefeitura Municipal de Abreu e Lima - PE,2600054,161894978.28,26630693,87182987.76000001,.35644469,2.9045615
Prefeitura Municipal de Afogados da Ingazeira - PE,2600104,86867129.81,0,46397993.54,0,2.8928819
Prefeitura Municipal de Afrânio - PE,2600203,46807742.09,7241426,25323807.63,.33706239,2.9039264
Prefeitura Municipal de Agrestina - PE,2600302,63501699.98,20830526,31363750.82,.6481598,2.91412
Prefeitura Municipal de Água Preta - PE,2600401,71470225.59,33881063,44910891.25,1.2756745,2.9346814
Prefeitura Municipal de Águas Belas - PE,2600500,82675313.14,26340879,53631575.25,.90693831,2.9225993
Prefeitura Municipal de Alagoinha - PE,2600609,38302170.43,4594135,21518601.06,.27372813,2.9018512
Prefeitura Municipal de Aliança - PE,2600708,75872028.26000001,41570634,60997879.31,2.7948244,2.9844589
Prefeitura Municipal de Altinho - PE,2600807,60143689.75,13248959,32259902.26,.47514918,2.9084511
Prefeitura Municipal de Amaraji - PE,2600906,49246663.26,15063857,37218617.43,1.2523944,2.9339187
Prefeitura Municipal de Angelim - PE,2601003,31043140.26,506816,19447098.82,.043705948,2.8943141
Prefeitura Municipal de Araçoiaba - PE,2601052,48487652.67,29635559,25357994.99,1.2812796,2.9348652
Prefeitura Municipal de Araripina - PE,2601102,171501592.66,73342863,99711154.37,1.0216244,2.926357
Prefeitura Municipal de Arcoverde - PE,2601201,148619516.27,2467392,77228567.77,.034561694,2.8940144
Prefeitura Municipal de Barra de Guabiraba - PE,2601300,24134521.24,9977710,24471856.38,-29.578033,1.9237093
Prefeitura Municipal de Barreiros - PE,2601409,92113617.09999999,36504055,58579560.04,1.0885667,2.9285507
Prefeitura Municipal de Belém de Maria - PE,2601508,32146198.34,10089335,13055087.95,.52848339,2.9101985
Prefeitura Municipal de Belém do São Francisco - PE,2601607,52614546.42,2840181,36489187.59,.17613134,2.8986533
Prefeitura Municipal de Belo Jardim - PE,2601706,200077032.82,18700796,143268243.77,.32918844,2.9036684
Prefeitura Municipal de Betânia - PE,2601805,33567926.66,7415277,22624621.77,.67760855,2.9150848
Prefeitura Municipal de Bezerros - PE,2601904,118419571.91,27491517,79456446.06999999,.70557779,2.9160013
Prefeitura Municipal de Bodocó - PE,2602001,45800301.24,6415198,45911351.19,-57.768581,.99999994
Prefeitura Municipal de Bom Conselho - PE,2602100,100264715.22,23706371,62938304.69,.63510984,2.9136922
Prefeitura Municipal de Bom Jardim - PE,2602209,73641178.36,2449795,45648420.4,.087515317,2.8957496
Prefeitura Municipal de Bonito - PE,2602308,79654143.70999999,27315539,49598724.76,.90883905,2.9226615
Prefeitura Municipal de Brejão - PE,2602407,28163723.28,543899,18721165.96,.057600815,2.8947694
Prefeitura Municipal de Brejinho - PE,2602506,25554816.72,0,13429191.4,0,2.8928819
Prefeitura Municipal de Brejo da Madre de Deus - PE,2602605,97641844.88,2380860,77710716.06,.11945435,2.896796
Prefeitura Municipal de Buenos Aires - PE,2602704,32696813.15,517672,18404769.27,.03622099,2.8940687
Prefeitura Municipal de Buíque - PE,2602803,106044750.54,3049525,72750591.54000001,.091593392,2.8958831
Prefeitura Municipal de Cabo de Santo Agostinho - PE,2602902,780591541.0599999,15517601,414902769.3,.042433899,2.8942723
Prefeitura Municipal de Cabrobó - PE,2603009,75488516.84,17427974,53297150.28,.78534931,2.9186151
Prefeitura Municipal de Cachoeirinha - PE,2603108,46236408.85,9666714,23116440.1,.41811103,2.9065821
Prefeitura Municipal de Caetés - PE,2603207,60630834.36,6911868,37439924.87,.29804212,2.9026477
Prefeitura Municipal de Calçado - PE,2603306,30018865.98,4591454,18659935.06,.40421534,2.9061267
Prefeitura Municipal de Calumbi - PE,2603405,23598395.28,1823904,15506138.93,.22538881,2.9002671
Prefeitura Municipal de Camaragibe - PE,2603454,307568144.98,52328908,189174081.87,.4419893,2.9073644
Prefeitura Municipal de Camocim de São Félix - PE,2603504,24832529.88,972438,20402832.07,.21952693,2.9000752
Prefeitura Municipal de Camutanga - PE,2603603,33776657.83,0,15022911.84,0,2.8928819
Prefeitura Municipal de Canhotinho - PE,2603702,69098194.15000001,5352662,33780740.34,.15155855,2.8978479
Prefeitura Municipal de Capoeiras - PE,2603801,47809930.8,1826266,29753273.66,.10114087,2.8961959
Prefeitura Municipal de Carnaíba - PE,2603900,51177002.59,0,26735562.4,0,2.8928819
Prefeitura Municipal de Carnaubeira da Penha - PE,2603926,27635916.92,1275628,16747766.75,.11715746,2.8967209
Prefeitura Municipal de Carpina - PE,2604007,145221284.32,21474732,104189000.68,.52336186,2.9100308
Prefeitura Municipal de Caruaru - PE,2604106,697360374.04,130590166,407185401.53,.45003939,2.9076283
Prefeitura Municipal de Casinhas - PE,2604155,38356320.27,9506589,25208374.7,.72304749,2.9165738
Prefeitura Municipal de Catende - PE,2604205,72562061.58,13290481,45533450.72,.49171898,2.908994
Prefeitura Municipal de Cedro - PE,2604304,33557219.15,0,15964646.52,0,2.8928819
Prefeitura Municipal de Chã de Alegria - PE,2604403,34029121.7,8572105,19474793.02,.58897287,2.9121807
Prefeitura Municipal de Chã Grande - PE,2604502,55843714.75,13975236,34232128.4,.64665478,2.9140706
Prefeitura Municipal de Condado - PE,2604601,55288902.89,34394958,35854516.3,1.769799,2.9508722
Prefeitura Municipal de Correntes - PE,2604700,44992751.31,414725,29850319.81,.027388269,2.8937793
Prefeitura Municipal de Cortês - PE,2604809,50220626.08,11327199,29160262.63,.53784442,2.9105053
Prefeitura Municipal de Cumaru - PE,2604908,35039044.05,18720205,23724722.43,1.6545583,2.9470963
Prefeitura Municipal de Cupira - PE,2605004,52829576.78,53511189,32079994.58,2.5789044,2.9773839
Prefeitura Municipal de Custódia - PE,2605103,104783300.78,11933430,62006935.56,.27897251,2.9020228
Prefeitura Municipal de Dormentes - PE,2605152,50545190.36,14406165,29021657.34,.6693216,2.9148133
Prefeitura Municipal de Escada - PE,2605202,120018774.08,39322786,87718392.61,1.2174094,2.9327724
Prefeitura Municipal de Exu - PE,2605301,69901478.14,0,45658482.24,0,2.8928819
Prefeitura Municipal de Feira Nova - PE,2605400,51380844.91,23060786,29208372.31,1.0400637,2.9269614
Prefeitura Municipal de Ferreiros - PE,2605509,29512888.6,-379799,19055589.86,-.036319036,2.8916919
Prefeitura Municipal de Flores - PE,2605608,47191755.21,0,27152249.82,0,2.8928819
Prefeitura Municipal de Floresta - PE,2605707,84715368.95999999,20497234,53185517.18,.65008974,2.9141831
Prefeitura Municipal de Frei Miguelinho - PE,2605806,33411502.03,7098089,20700920.61,.55843937,2.91118
Prefeitura Municipal de Gameleira - PE,2605905,33210694.77,12262637,33014874.81,62.621998,4.9447942
Prefeitura Municipal de Garanhuns - PE,2606002,282783989.71,8044246,183655349.75,.081149563,2.895541
Prefeitura Municipal de Glória do Goitá - PE,2606101,58323731.62,3377492,33425840.59,.13565373,2.8973269
Prefeitura Municipal de Goiana - PE,2606200,254519138.6,50743378,135872727.1,.42768574,2.9068959
Prefeitura Municipal de Granito - PE,2606309,25820507.2,666444,12961719.47,.051827904,2.8945801
Prefeitura Municipal de Gravatá - PE,2606408,167242958.57,61803438,104729890.48,.9886483,2.9252765
Prefeitura Municipal de Iati - PE,2606507,43196520.67,14252514,34059451.76,1.5598563,2.9439931
Prefeitura Municipal de Ibimirim - PE,2606606,46592240.97,8070485,33233920.35,.60415417,2.912678
Prefeitura Municipal de Ibirajuba - PE,2606705,14021055.88,8190609,13708918.27,26.240379,3.7526908
Prefeitura Municipal de Igarassu - PE,2606804,241426843.65,38258460,153924627.86,.43722847,2.9072084
Prefeitura Municipal de Iguaracy - PE,2606903,31235612.3,0,17525290.48,0,2.8928819
Prefeitura Municipal de Inajá - PE,2607000,43122734.05,6807409,25559292.96,.38758969,2.905582
Prefeitura Municipal de Ingazeira - PE,2607109,20713034.84,0,10379318.12,0,2.8928819
Prefeitura Municipal de Ipojuca - PE,2607208,842215513.74,20647798,448008490.36,.052378058,2.8945982
Prefeitura Municipal de Ipubi - PE,2607307,68815091.98999999,18924814,39278584.8,.64072621,2.9138763
Prefeitura Municipal de Itacuruba - PE,2607406,29468986.93,8699228,17217920.88,.71007925,2.9161489
Prefeitura Municipal de Itaíba - PE,2607505,80859470.03,973955,40090976.52,.023889894,2.8936648
Prefeitura Municipal de Ilha de Itamaracá - PE,2607604,64609021.83,17932980,38725790.68,.69284165,2.9155841
Prefeitura Municipal de Itambé - PE,2607653,68982694.34,30753930,36343338.49,.94223458,2.9237559
Prefeitura Municipal de Itapetim - PE,2607703,38431737.63,0,22172736.67,0,2.8928819
Prefeitura Municipal de Itapissuma - PE,2607752,101467129.21,5810178,56311079.75,.12866887,2.8970981
Prefeitura Municipal de Itaquitinga - PE,2607802,38080383.98,8429888,27908530.82,.82874656,2.9200373
Prefeitura Municipal de Jaboatão dos Guararapes - PE,2607901,1280266217.13,130309170,695103345.55,.22268872,2.9001787
Prefeitura Municipal de Jaqueira - PE,2607950,38767779.1,20323544,22750890.01,1.2688822,2.934459
Prefeitura Municipal de Jataúba - PE,2608008,46531904.59,0,24068753.73,0,2.8928819
Prefeitura Municipal de Jatobá - PE,2608057,36001516.01,9695914,20550108.91,.62751007,2.9134433
Prefeitura Municipal de João Alfredo - PE,2608107,65493415.71,25679952,42281391.4,1.1063211,2.9291325
Prefeitura Municipal de Joaquim Nabuco - PE,2608206,44591431.09,9107533,23339042.65,.42854163,2.9069238
Prefeitura Municipal de Jucati - PE,2608255,35013264.04,896202,19944087.04,.059472524,2.8948307
Prefeitura Municipal de Jupi - PE,2608305,46754466.19,0,25603966.91,0,2.8928819
Prefeitura Municipal de Jurema - PE,2608404,24103400.67,8326770,23695139.1,20.395674,3.5611796
Prefeitura Municipal de Lagoa do Carro - PE,2608453,42905783.63,14902355,29953210.42,1.1505324,2.9305811
Prefeitura Municipal de Lagoa de Itaenga - PE,2608503,49895935.75,41881286,36627146.27,3.1563759,2.9963057
Prefeitura Municipal de Lagoa do Ouro - PE,2608602,39752507.01,1978861,23218183.74,.11968201,2.8968036
Prefeitura Municipal de Lagoa dos Gatos - PE,2608701,35788296.83,1428446,16177457.32,.072839618,2.8952687
Prefeitura Municipal de Lagoa Grande - PE,2608750,63419947.31,7303209,35414506.78,.26077822,2.9014268
Prefeitura Municipal de Lajedo - PE,2608800,90492936.55,2901363,56231289.7,.084682532,2.8956566
Prefeitura Municipal de Limoeiro - PE,2608909,114781680.64,8885481,72885958.28,.21208563,2.8998313
Prefeitura Municipal de Macaparana - PE,2609006,59950571.29,1089776,39378793.77,.052974325,2.8946178
Prefeitura Municipal de Machados - PE,2609105,34954069.2,7402729,21783509.88,.56206644,2.911299
Prefeitura Municipal de Manari - PE,2609154,49346047.2,462054,29801078.01,.02364056,2.8936565
Prefeitura Municipal de Maraial - PE,2609204,31708231.43,9995421,23096061.93,1.1606159,2.9309113
Prefeitura Municipal de Mirandiba - PE,2609303,35676965.68,164758,26945079.75,.018868547,2.8935001
Prefeitura Municipal de Moreno - PE,2609402,117744034.49,61111961,71319568.40000001,1.3163741,2.9360151
Prefeitura Municipal de Nazaré da Mata - PE,2609501,57889224.67,61457696,47133838.81,5.7141323,3.0801148
Prefeitura Municipal de Olinda - PE,2609600,656096384.34,97472662,336943359.23,.30541041,2.9028893
Prefeitura Municipal de Orobó - PE,2609709,56893847.89,21573899,33200331.98,.91054022,2.9227173
Prefeitura Municipal de Orocó - PE,2609808,39553321.57,3223880,27568478.7,.26899645,2.901696
Prefeitura Municipal de Ouricuri - PE,2609907,57806226.12,102491794,80743205.59,-4.4684086,2.7464671
Prefeitura Municipal de Palmares - PE,2610004,138750570.69,32677853,83954397,.59635282,2.9124224
Prefeitura Municipal de Palmeirina - PE,2610103,24582800.01,1023063,19015504.86,.18376303,2.8989031
Prefeitura Municipal de Panelas - PE,2610202,66489399.27,12801878,45131477.64,.59939718,2.9125221
Prefeitura Municipal de Paranatama - PE,2610301,41186440.48,8894916,24809132.7,.54312444,2.9106784
Prefeitura Municipal de Parnamirim - PE,2610400,48146352.42,16866388,33215175.84,1.1296088,2.9298954
Prefeitura Municipal de Passira - PE,2610509,58584515.97,14317277,44880260.74,1.0447322,2.9271142
Prefeitura Municipal de Paudalho - PE,2610608,107392354.78,73950754,57324372.37,1.4770069,2.9412785
Prefeitura Municipal de Paulista - PE,2610707,486251817.14,32363629,295882786.82,.1700047,2.8984525
Prefeitura Municipal de Pedra - PE,2610806,49731048.49,0,31544437.59,0,2.8928819
Prefeitura Municipal de Pesqueira - PE,2610905,128461414.34,36810771,79587873.91,.75318402,2.9175613
Prefeitura Municipal de Petrolândia - PE,2611002,84227452.37,1989189,53868528.02,.06552238,2.8950288
Prefeitura Municipal de Petrolina - PE,2611101,694278546.28,165469548,382478989.13,.53069204,2.9102709
Prefeitura Municipal de Poção - PE,2611200,30827952.3,6103479,17397309.69,.45444429,2.9077725
Prefeitura Municipal de Pombos - PE,2611309,61828882.73,4779288,41568169,.23588942,2.9006112
Prefeitura Municipal de Primavera - PE,2611408,35739097.99,17402590,19333143.92,1.0607485,2.927639
Prefeitura Municipal de Quipapá - PE,2611507,54513364.27,99663,36091598.75,.0054100677,2.8930593
Prefeitura Municipal de Quixaba - PE,2611533,26953254.64,0,12609554.21,0,2.8928819
Prefeitura Municipal de Recife - PE,2611606,4695227028.32,1177291376,2567267043.4,.55324882,2.91101
Prefeitura Municipal de Riacho das Almas - PE,2611705,50382528.79,7050315,33330398.36,.41345656,2.9064295
Prefeitura Municipal de Ribeirão - PE,2611804,86293651.94,29807767,64660147.02,1.377852,2.9380295
Prefeitura Municipal de Rio Formoso - PE,2611903,64464695.15,60031334,37253497.26,2.2061262,2.9651692
Prefeitura Municipal de Sairé - PE,2612000,28421997.61,20963284,17558046,1.9296187,2.956109
Prefeitura Municipal de Salgadinho - PE,2612109,26577532.86,10103745,16786301.66,1.0319177,2.9266944
Prefeitura Municipal de Salgueiro - PE,2612208,129753512.16,18140222,82401482.06,.38309279,2.9054346
Prefeitura Municipal de Saloá - PE,2612307,40245717.99,1434344,29884534.44,.13843438,2.897418
Prefeitura Municipal de Sanharó - PE,2612406,31474787.5,16466827,24619377.25,2.4020193,2.9715881
Prefeitura Municipal de Santa Cruz - PE,2612455,38977280.46,3727162,20435764.29,.20101711,2.8994687
Prefeitura Municipal de Santa Cruz da Baixa Verde - PE,2612471,33873351.94,22251,20067215.28,.0016116747,2.8929348
Prefeitura Municipal de Santa Cruz do Capibaribe - PE,2612505,173850741.36,16215329,101118189.23,.22294459,2.900187
Prefeitura Municipal de Santa Filomena - PE,2612554,39346197.02,3277678,19711605.35,.16693385,2.8983519
